{
  "schemaVersion": 1,
  "eventId": "aaaaaaaa-aaaa-4aaa-8aaa-aaaaaaaaaaaa",
  "eventType": "workspace.ai.task.requested",
  "organizationId": "11111111-1111-4111-8111-111111111111",
  "workspaceId": "22222222-2222-4222-8222-222222222222",
  "userId": "33333333-3333-4333-8333-333333333333",
  "correlationId": "44444444-4444-4444-8444-444444444444",
  "stateVersion": 0,
  "timestamp": "2026-07-09T12:00:00.000Z",
  "payload": { "taskId": "55555555-5555-4555-8555-555555555555" }
}
